item_id,source_type,condition,text,word_ai_prob,stylometric_ai_prob,word_count,type_token_ratio
fresh_0,fresh_model_generation,baseline,"When people give money to support a project on a donation site like Kickstarter, they trust that the person asking for money will use it to make the idea happen. But what stops someone from just taking the money and running away? First, these sites have rules and checks to make sure people are real and serious about their projects. If someone steals the money, they can get into big trouble with the law because that’s called stealing or fraud, and it can lead to fines or jail. Also, the community of backers—the people who give money—talk a lot online and share news. If someone cheats, their name gets out, and no one will trust them again. Plus, many projects need to show progress by sharing updates and pictures, so it’s hard to hide what’s really happening. So, even though it’s not impossible, many things like rules, trust, and the law make it very risky and hard for someone to just take the money and run without anyone noticing.",0.6890384173241575,0.7806153691022525,175.0,0.6342857142857142
fresh_0,fresh_model_generation,one_shot,"When people donate to a project on sites like Kickstarter, they trust that the creator will use the money to bring their idea to life. But what’s stopping someone from just taking the cash and disappearing? For starters, these platforms have rules and verification processes to make sure project creators are legitimate and serious. If someone does steal the money, they’re breaking the law—fraud or theft can lead to fines or even jail time. On top of that, backers form a tight-knit community that talks online and shares information. If someone scams people, word spreads fast, and they lose all credibility. Many projects also have to post regular updates and photos, making it tough to hide what’s really going on. So while it’s not impossible, a mix of platform rules, community oversight, and legal consequences makes it risky and difficult for someone to just take the money and run without getting caught.",0.6525008659230098,0.6569187094027543,158.0,0.6962025316455697
fresh_0,fresh_model_generation,iter_round_1,"When people donate money to support a project on sites like Kickstarter, they trust that the creator will use the funds to bring the idea to life. But what prevents someone from taking the money and disappearing? First, these platforms have rules and verification processes to ensure creators are genuine and committed. If someone misappropriates funds, they risk serious legal consequences, including fines or jail time, since that’s considered theft or fraud. Additionally, the community of backers stays connected online, sharing information and calling out dishonest behavior—once someone cheats, their reputation is ruined. Many projects also have to provide regular updates and photos, making it difficult to hide what’s really going on. So, while it’s not impossible, a combination of rules, community oversight, and legal risks makes it very risky and unlikely for someone to just take the money and run unnoticed.",0.64331312325443,0.6695398386774107,146.0,0.7328767123287672
fresh_0,fresh_model_generation,iter_round_2,"When people donate money to support a project on a site like Kickstarter, they’re trusting that the creator will actually use the funds to make their idea happen. But what stops someone from just taking the money and disappearing? Well, these sites have rules and checks to make sure people are real and serious about their projects. If someone does steal the money, they can get into serious legal trouble—because that’s basically fraud, and it can mean fines or even jail time. On top of that, backers talk a lot online and share information. If someone cheats, word spreads quickly, and no one will trust them again. Plus, many projects have to post regular updates and photos, so it’s hard to hide what’s really going on. So, while it’s not impossible, the rules, the community, and the law make it risky and tough for someone to just take the money and run without anyone noticing.",0.6634651857716526,0.7142266756844121,161.0,0.6645962732919255
fresh_0,fresh_model_generation,iterative_final,"When people donate money to support a project on a site like Kickstarter, they’re trusting that the creator will actually use the funds to make their idea happen. But what stops someone from just taking the money and disappearing? Well, these sites have rules and checks to make sure people are real and serious about their projects. If someone does steal the money, they can get into serious legal trouble—because that’s basically fraud, and it can mean fines or even jail time. On top of that, backers talk a lot online and share information. If someone cheats, word spreads quickly, and no one will trust them again. Plus, many projects have to post regular updates and photos, so it’s hard to hide what’s really going on. So, while it’s not impossible, the rules, the community, and the law make it risky and tough for someone to just take the money and run without anyone noticing.",0.6634651857716526,0.7142266756844121,161.0,0.6645962732919255
fresh_0,fresh_model_generation,human_reference,"Nothing . In fact , it 's a problem that crops up on the occasion .",0.45539868626936747,0.2785639187910565,13.0,1.0
fresh_1,fresh_model_generation,baseline,"A long time ago, like in the 1700s, big ships didn’t have engines like today, so they couldn’t just start moving on their own. When it was time to leave the dock, sailors had to be very clever, especially if the wind was blowing toward the land, which made it hard for the sails to help push the ship away from the shore. To solve this, people on the dock or on smaller boats called rowboats or tugboats would use long poles or oars to gently push the big ship away from the dock. Sometimes, strong sailors on the ship would jump onto the dock and push off with poles while others pulled ropes to help guide the ship out. If the wind was blowing the wrong way, they had to row or use special ropes called “warps” tied to anchors or trees to slowly pull or push the ship into the water. It was like giving the ship a little shove so it could start sailing safely out to sea.",0.45003856103894174,0.5105611749418161,173.0,0.5664739884393064
fresh_1,fresh_model_generation,one_shot,"Back in the 1700s, big ships didn’t have engines like they do today, so they couldn’t just start moving on their own. When it was time to leave the dock, sailors had to get creative—especially if the wind was blowing toward the shore, which made it tough for the sails to push the ship away. To fix this, people on the dock or in smaller boats called rowboats or tugboats would use long poles or oars to gently nudge the ship away from the dock. Sometimes, strong sailors would jump onto the dock to push off with poles while others pulled ropes to help guide the ship out. If the wind wasn’t on their side, they’d row or use special ropes called “warps” tied to anchors or trees to slowly pull or push the ship into the water. It was basically giving the ship a little shove so it could safely start its journey out to sea.",0.4536002608482123,0.5003021955905504,162.0,0.6172839506172839
fresh_1,fresh_model_generation,iter_round_1,"Back in the 1700s, big ships didn’t have engines like they do today, so they couldn’t move on their own. When it was time to leave the dock, sailors had to get creative—especially if the wind was blowing toward land, which made it hard for the sails to push the ship away. To solve this, people on the dock or in smaller boats like rowboats or tugboats would use long poles or oars to gently push the ship away from the shore. Sometimes, strong sailors on the ship would jump onto the dock and push off with poles while others pulled ropes to guide the ship out. If the wind was blowing the wrong way, they had to row or use special ropes called “warps,” tied to anchors or trees, to slowly pull or push the ship into the water. It was like giving the ship a little shove to help it start sailing safely out to sea.",0.4416281034352017,0.4970404526888506,161.0,0.5962732919254659
fresh_1,fresh_model_generation,iter_round_2,"Back in the 1700s, big ships didn’t have engines, so they couldn’t just start moving on their own. When it was time to leave the dock, sailors had to get creative—especially if the wind was blowing toward the land, making it tough for the sails to push the ship away. To get around this, folks on the dock or in smaller boats like rowboats or tugboats would use long poles or oars to gently nudge the ship off the shore. Sometimes, strong sailors would hop onto the dock themselves, pushing with poles while others pulled ropes to guide the ship out. If the wind was in the wrong direction, they’d have to row or use special ropes called “warps,” tied to anchors or trees, to slowly pull or push the ship into the water. It was basically giving the ship a little shove to help it start sailing safely out to sea.",0.5044053043310582,0.4537127049567851,156.0,0.6217948717948718
fresh_1,fresh_model_generation,iterative_final,"Back in the 1700s, big ships didn’t have engines, so they couldn’t just start moving on their own. When it was time to leave the dock, sailors had to get creative—especially if the wind was blowing toward the land, making it tough for the sails to push the ship away. To get around this, folks on the dock or in smaller boats like rowboats or tugboats would use long poles or oars to gently nudge the ship off the shore. Sometimes, strong sailors would hop onto the dock themselves, pushing with poles while others pulled ropes to guide the ship out. If the wind was in the wrong direction, they’d have to row or use special ropes called “warps,” tied to anchors or trees, to slowly pull or push the ship into the water. It was basically giving the ship a little shove to help it start sailing safely out to sea.",0.5044053043310582,0.4537127049567851,156.0,0.6217948717948718
fresh_1,fresh_model_generation,human_reference,"No expert , but one method is warping . An anchor is carried away by boat and dropped in the direction you want to go , and then you pull the ship to it using the ships winches . Repeat as necessary . Sometimes you just had to wait for a favourable wind .",0.529283215992685,0.25821396098653976,48.0,0.8333333333333334
fresh_2,fresh_model_generation,baseline,"Before World War II, many countries in Western Europe did not expect Germany to start another big war so quickly. After World War I, Germany was very weak and had to follow strict rules that stopped it from having a strong army. People hoped that peace would last and thought that Germany would not try to fight again soon. Also, the countries like Britain and France were busy fixing their own problems and did not spend enough time or money getting ready for another war. When Hitler came to power, he secretly built up Germany’s army very fast, but other countries did not notice or believe it would be a real threat. When Germany attacked, many armies were not ready, and the way Germany fought was very fast and smart, using tanks and planes together to surprise their enemies. Because of this, Germany was able to take over a lot of land quickly, and Western Europe was caught off guard, making it hard to stop the invasion at the start of the war.",0.5401989541928669,0.5831055463369795,174.0,0.632183908045977
fresh_2,fresh_model_generation,one_shot,"Before World War II, most Western European countries didn’t expect Germany to start another major conflict so soon. After World War I, Germany was weakened and forced to follow strict rules that limited its military power. People hoped peace would last and believed Germany wouldn’t be ready to fight again anytime soon. Meanwhile, countries like Britain and France were focused on their own issues and didn’t invest enough time or resources into preparing for another war. When Hitler came to power, he secretly rebuilt Germany’s army at a rapid pace, but other nations either didn’t notice or didn’t see it as a serious threat. So, when Germany launched its attack, many armies were caught off guard. Germany’s strategy was fast and clever, combining tanks and planes to overwhelm their opponents. Because of this, Germany quickly gained control of large areas, leaving Western Europe unprepared and struggling to respond in the early days of the war.",0.3832760077184715,0.4506998982448742,162.0,0.7222222222222222
fresh_2,fresh_model_generation,iter_round_1,"Before World War II, many Western European countries didn’t expect Germany to start another major war so soon. After World War I, Germany was weakened and forced to follow strict rules that limited its military power. People hoped peace would last and believed Germany wouldn’t try to fight again anytime soon. Meanwhile, countries like Britain and France were focused on solving their own problems and didn’t invest enough time or money preparing for another conflict. When Hitler came to power, he rapidly and secretly rebuilt Germany’s army, but other nations either didn’t notice or didn’t see it as a serious threat. When Germany launched its attack, many armies were unprepared, and Germany’s fast, clever tactics—using tanks and planes together—caught their enemies off guard. As a result, Germany quickly conquered large areas, surprising Western Europe and making it difficult to stop the invasion at the war’s outset.",0.46753274446926124,0.48248217791476167,156.0,0.7115384615384616
fresh_2,fresh_model_generation,iter_round_2,"Before World War II, most countries in Western Europe didn’t expect Germany to start another big war so soon. After World War I, Germany was weak and forced to follow strict rules that limited its military. People hoped peace would last and believed Germany wouldn’t try to fight again anytime soon. At the same time, countries like Britain and France were focused on their own problems and didn’t spend enough time or money preparing for another war. When Hitler came to power, he quickly and secretly rebuilt Germany’s army, but other countries either didn’t notice or didn’t think it was a real threat. So when Germany attacked, many armies were caught off guard. Germany’s fast and clever use of tanks and planes together surprised their enemies and helped them take over a lot of land quickly. Because of this, Western Europe was unprepared and struggled to stop the invasion at the start of the war.",0.43714408675585037,0.5357471572742196,162.0,0.6666666666666666
fresh_2,fresh_model_generation,iterative_final,"Before World War II, most countries in Western Europe didn’t expect Germany to start another big war so soon. After World War I, Germany was weak and forced to follow strict rules that limited its military. People hoped peace would last and believed Germany wouldn’t try to fight again anytime soon. At the same time, countries like Britain and France were focused on their own problems and didn’t spend enough time or money preparing for another war. When Hitler came to power, he quickly and secretly rebuilt Germany’s army, but other countries either didn’t notice or didn’t think it was a real threat. So when Germany attacked, many armies were caught off guard. Germany’s fast and clever use of tanks and planes together surprised their enemies and helped them take over a lot of land quickly. Because of this, Western Europe was unprepared and struggled to stop the invasion at the start of the war.",0.43714408675585037,0.5357471572742196,162.0,0.6666666666666666
fresh_2,fresh_model_generation,human_reference,"The losses incurred in WW1 by Europe at large can not be overstated . Their population was wrecked by conflict on their own soil which raged across the continent . Germany was far less impacted by localized violence then , say , France , and the dangers of early 20th century warfare left populations with poisoned land , low food security , and slow recuperation of population . Treaties placed on Germany were thought sufficient to keep the available government under control . The severe economic impositions made Germans limit their infrastructure to civic projects . You know , the kind of thing that increases population and develop quickly . Complacency , a generally difficult recovery , and the desire to move forward left many European nations flatfooted .",0.4410651818712401,0.16189234369892358,114.0,0.7982456140350878
external_0,external_ai_text,original_external,"Dominion Resources holds initial talks with East Midlands Electricity over takeover bid Dominion Resources, one of the largest energy companies in the U.S., has held preliminary discussions about acquiring East Midlands Electricity (EME) Plc, a regional power distribution company in central England, according to people familiar with the matter. Representatives from Dominion and EME met last week to discuss a potential deal that could value EME at more than £2 billion ($2.6 billion), said the people, who asked not to be identified discussing confidential information. The talks are ongoing and could still fall apart, the people added. Dominion sees EME as an attractive takeover target due to its stable base of more than 4 million customers in a region that has been growing faster than the rest of the U.K., the people said. However, there are significant regulatory and political hurdles to cross, including a general election in May. A takeover of EME would be the largest ever for Dominion and would serve to diversify its geographic reach and complement its regulated electric and natural gas utility businesses in parts of the Eastern U.S., the Dominion officials noted. Dominion Chief Executive Officer Thomas Farrell sees international acquisitions as key to the company’s long-term growth. In recent years, Dominion has looked at potential targets in Europe, including in the U.K. Before Dominion’s interest, EME had not been formally up for sale and has a stable major shareholder base, the people said. EME's majority investors are U.K.-based, while remaining shares are held by retail and institutional shareholders. EME employs more than 4,300 people and has a market value of about £1.96 billion. It owns and operates electricity distribution networks in central England, including Nottinghamshire, Leicestershire, Derbyshire, and Lincolnshire. EME is regulated by the British energy regulator Ofgem, which would have to approve any takeover of the company. EME has delivered stable returns and dividends for shareholders for the past decade. Continued on next page...",0.6846321432242369,0.6033610050268248,326.0,0.5521472392638037
external_0,external_ai_text,one_shot,"Dominion Resources has started initial talks with East Midlands Electricity (EME) about a possible takeover. Dominion, one of the largest energy companies in the U.S., recently met with EME representatives to explore a deal that could value the regional power distributor at over £2 billion ($2.6 billion), according to sources familiar with the discussions who asked to remain anonymous. The talks are still ongoing and may not lead to a deal. Dominion is interested in EME because of its stable customer base of more than 4 million in a region growing faster than much of the U.K. However, there are significant regulatory and political challenges ahead, especially with a general election scheduled for May. For Dominion, acquiring EME would be its largest takeover to date and would help diversify its geographic footprint, complementing its regulated electric and natural gas utilities in the Eastern U.S. CEO Thomas Farrell has emphasized international acquisitions as a key part of the company’s long-term growth strategy. Dominion has been exploring opportunities in Europe, including the U.K., for some time. Before Dominion’s interest, EME was not officially",0.6494573268087922,0.5922745964155806,185.0,0.654054054054054
external_0,external_ai_text,iter_round_1,"Dominion Resources has begun initial talks with East Midlands Electricity (EME) regarding a potential takeover. Dominion, one of the largest energy companies in the U.S., held preliminary discussions last week about acquiring EME, a regional power distributor in central England, according to sources familiar with the matter. The proposed deal could value EME at over £2 billion ($2.6 billion), though talks are ongoing and may still fall through, the sources added. Dominion views EME as an appealing target due to its stable customer base of more than 4 million in a region growing faster than the rest of the U.K. However, significant regulatory and political challenges remain, including an upcoming general election in May. If completed, this would be Dominion’s largest acquisition to date, expanding its geographic footprint and complementing its regulated electric and natural gas utilities in the Eastern U.S., according to company officials. CEO Thomas Farrell considers international acquisitions vital to Dominion’s long-term growth, and the company has recently explored opportunities in Europe, including the U.K. Before Dominion’s interest, EME had not been formally put",0.5638285393592187,0.5222592481786393,182.0,0.6868131868131868
external_0,external_ai_text,iter_round_2,"Dominion Resources, one of the biggest energy companies in the U.S., has started early talks about buying East Midlands Electricity (EME), a regional power distributor in central England. Sources close to the situation say representatives from both companies met last week to discuss a possible deal that could value EME at more than £2 billion ($2.6 billion). These talks are still ongoing and could fall through. Dominion is interested in EME because it has a stable customer base of over 4 million people in a part of the U.K. that’s growing faster than others. But there are major regulatory and political hurdles to clear, including a general election coming up in May. If the deal goes through, it would be Dominion’s biggest acquisition so far and help the company expand beyond its electric and natural gas utilities in the Eastern U.S. Dominion’s CEO, Thomas Farrell, sees international deals like this as key to the company’s future growth. In recent years, Dominion has looked at potential targets in Europe, including the U.K. Before this, EME wasn’t officially for sale and has a",0.5943883111336358,0.6640841728529074,187.0,0.6631016042780749
external_0,external_ai_text,iterative_final,"Dominion Resources, one of the biggest energy companies in the U.S., has started early talks about buying East Midlands Electricity (EME), a regional power distributor in central England. Sources close to the situation say representatives from both companies met last week to discuss a possible deal that could value EME at more than £2 billion ($2.6 billion). These talks are still ongoing and could fall through. Dominion is interested in EME because it has a stable customer base of over 4 million people in a part of the U.K. that’s growing faster than others. But there are major regulatory and political hurdles to clear, including a general election coming up in May. If the deal goes through, it would be Dominion’s biggest acquisition so far and help the company expand beyond its electric and natural gas utilities in the Eastern U.S. Dominion’s CEO, Thomas Farrell, sees international deals like this as key to the company’s future growth. In recent years, Dominion has looked at potential targets in Europe, including the U.K. Before this, EME wasn’t officially for sale and has a",0.5943883111336358,0.6640841728529074,187.0,0.6631016042780749
